

================================================================
== Vitis HLS Report for 'dct_1d'
================================================================
* Date:           Mon Mar  6 13:37:03 2023

* Version:        2022.1 (Build 3526262 on Mon Apr 18 15:48:16 MDT 2022)
* Project:        dct_prj
* Solution:       solution4 (Vivado IP Flow Target)
* Product family: zynq
* Target device:  xc7z020-clg400-1


================================================================
== Performance Estimates
================================================================
+ Timing: 
    * Summary: 
    +--------+----------+----------+------------+
    |  Clock |  Target  | Estimated| Uncertainty|
    +--------+----------+----------+------------+
    |ap_clk  |  10.00 ns|  6.383 ns|     2.70 ns|
    +--------+----------+----------+------------+

+ Latency: 
    * Summary: 
    +---------+---------+----------+----------+-----+-----+---------+
    |  Latency (cycles) |  Latency (absolute) |  Interval | Pipeline|
    |   min   |   max   |    min   |    max   | min | max |   Type  |
    +---------+---------+----------+----------+-----+-----+---------+
    |       16|       16|  0.160 us|  0.160 us|   16|   16|       no|
    +---------+---------+----------+----------+-----+-----+---------+

    + Detail: 
        * Instance: 
        N/A

        * Loop: 
        +------------------+---------+---------+----------+-----------+-----------+------+----------+
        |                  |  Latency (cycles) | Iteration|  Initiation Interval  | Trip |          |
        |     Loop Name    |   min   |   max   |  Latency |  achieved |   target  | Count| Pipelined|
        +------------------+---------+---------+----------+-----------+-----------+------+----------+
        |- DCT_Outer_Loop  |       14|       14|         8|          1|          1|     8|       yes|
        +------------------+---------+---------+----------+-----------+-----------+------+----------+

============================================================
+ Verbose Summary: Synthesis Manager
============================================================
InlineROM: 1
ExposeGlobal: 0
============================================================
+ Verbose Summary: CDFG Model
============================================================
IsTopModel: 0
ResetActiveHigh: 1
IsCombinational: 0
IsDatapathOnly: 0
HasWiredReturn: 1
HasMFsm: 2
HasVarLatency: 1
IsPipeline: 0
IsRtlPipelined: 0
IsInstanceOverlapped: 0
IsDontTouch: 0
HasImplIP: 0
IsGatedGlobalClock: 0

+ Individual pipeline summary: 
  * Pipeline-0: initiation interval (II) = 1, depth = 8


============================================================
+ Verbose Summary: Schedule
============================================================
* Number of FSM states : 8
* Pipeline : 1
  Pipeline-0 : II = 1, D = 8, States = { 1 2 3 4 5 6 7 8 }
* Dataflow Pipeline: 0

* FSM state transitions: 
1 --> 2 
2 --> 3 
3 --> 4 
4 --> 5 
5 --> 6 
6 --> 7 
7 --> 8 
8 --> 

* FSM state operations: 

State 1 <SV = 0> <Delay = 3.32>
ST_1 : Operation 11 [1/1] (0.00ns)   --->   "%k = alloca i32 1"   --->   Operation 11 'alloca' 'k' <Predicate = true> <Delay = 0.00>
ST_1 : Operation 12 [1/1] (0.00ns)   --->   "%dst_offset_read = read i3 @_ssdm_op_Read.ap_auto.i3, i3 %dst_offset" [dct.cpp:22]   --->   Operation 12 'read' 'dst_offset_read' <Predicate = true> <Delay = 0.00>
ST_1 : Operation 13 [1/1] (0.00ns)   --->   "%p_read_1 = read i16 @_ssdm_op_Read.ap_auto.i16, i16 %p_read7" [dct.cpp:22]   --->   Operation 13 'read' 'p_read_1' <Predicate = true> <Delay = 0.00>
ST_1 : Operation 14 [1/1] (0.00ns)   --->   "%p_read_2 = read i16 @_ssdm_op_Read.ap_auto.i16, i16 %p_read6" [dct.cpp:22]   --->   Operation 14 'read' 'p_read_2' <Predicate = true> <Delay = 0.00>
ST_1 : Operation 15 [1/1] (0.00ns)   --->   "%p_read_3 = read i16 @_ssdm_op_Read.ap_auto.i16, i16 %p_read5" [dct.cpp:22]   --->   Operation 15 'read' 'p_read_3' <Predicate = true> <Delay = 0.00>
ST_1 : Operation 16 [1/1] (0.00ns)   --->   "%p_read_4 = read i16 @_ssdm_op_Read.ap_auto.i16, i16 %p_read4" [dct.cpp:22]   --->   Operation 16 'read' 'p_read_4' <Predicate = true> <Delay = 0.00>
ST_1 : Operation 17 [1/1] (0.00ns)   --->   "%p_read_5 = read i16 @_ssdm_op_Read.ap_auto.i16, i16 %p_read3" [dct.cpp:22]   --->   Operation 17 'read' 'p_read_5' <Predicate = true> <Delay = 0.00>
ST_1 : Operation 18 [1/1] (0.00ns)   --->   "%p_read_6 = read i16 @_ssdm_op_Read.ap_auto.i16, i16 %p_read2" [dct.cpp:22]   --->   Operation 18 'read' 'p_read_6' <Predicate = true> <Delay = 0.00>
ST_1 : Operation 19 [1/1] (0.00ns)   --->   "%p_read_7 = read i16 @_ssdm_op_Read.ap_auto.i16, i16 %p_read1" [dct.cpp:22]   --->   Operation 19 'read' 'p_read_7' <Predicate = true> <Delay = 0.00>
ST_1 : Operation 20 [1/1] (0.00ns)   --->   "%p_read_8 = read i16 @_ssdm_op_Read.ap_auto.i16, i16 %p_read" [dct.cpp:22]   --->   Operation 20 'read' 'p_read_8' <Predicate = true> <Delay = 0.00>
ST_1 : Operation 21 [1/1] (0.00ns)   --->   "%tmp = bitconcatenate i6 @_ssdm_op_BitConcatenate.i6.i3.i3, i3 %dst_offset_read, i3 0" [dct.cpp:22]   --->   Operation 21 'bitconcatenate' 'tmp' <Predicate = true> <Delay = 0.00>
ST_1 : Operation 22 [1/1] (0.00ns)   --->   "%sext_ln8 = sext i16 %p_read_8" [dct.cpp:8]   --->   Operation 22 'sext' 'sext_ln8' <Predicate = true> <Delay = 0.00>
ST_1 : Operation 23 [1/1] (0.00ns)   --->   "%sext_ln19 = sext i16 %p_read_7" [dct.cpp:19]   --->   Operation 23 'sext' 'sext_ln19' <Predicate = true> <Delay = 0.00>
ST_1 : Operation 24 [1/1] (0.00ns)   --->   "%sext_ln19_1 = sext i16 %p_read_6" [dct.cpp:19]   --->   Operation 24 'sext' 'sext_ln19_1' <Predicate = true> <Delay = 0.00>
ST_1 : Operation 25 [1/1] (0.00ns)   --->   "%sext_ln19_2 = sext i16 %p_read_5" [dct.cpp:19]   --->   Operation 25 'sext' 'sext_ln19_2' <Predicate = true> <Delay = 0.00>
ST_1 : Operation 26 [1/1] (0.00ns)   --->   "%sext_ln19_3 = sext i16 %p_read_4" [dct.cpp:19]   --->   Operation 26 'sext' 'sext_ln19_3' <Predicate = true> <Delay = 0.00>
ST_1 : Operation 27 [1/1] (0.00ns)   --->   "%sext_ln19_4 = sext i16 %p_read_3" [dct.cpp:19]   --->   Operation 27 'sext' 'sext_ln19_4' <Predicate = true> <Delay = 0.00>
ST_1 : Operation 28 [1/1] (0.00ns)   --->   "%sext_ln19_5 = sext i16 %p_read_2" [dct.cpp:19]   --->   Operation 28 'sext' 'sext_ln19_5' <Predicate = true> <Delay = 0.00>
ST_1 : Operation 29 [1/1] (0.00ns)   --->   "%sext_ln22 = sext i16 %p_read_1" [dct.cpp:22]   --->   Operation 29 'sext' 'sext_ln22' <Predicate = true> <Delay = 0.00>
ST_1 : Operation 30 [1/1] (1.58ns)   --->   "%store_ln16 = store i4 0, i4 %k" [dct.cpp:16]   --->   Operation 30 'store' 'store_ln16' <Predicate = true> <Delay = 1.58>
ST_1 : Operation 31 [1/1] (0.00ns)   --->   "%br_ln16 = br void %for.inc" [dct.cpp:16]   --->   Operation 31 'br' 'br_ln16' <Predicate = true> <Delay = 0.00>
ST_1 : Operation 32 [1/1] (0.00ns)   --->   "%k_1 = load i4 %k" [dct.cpp:16]   --->   Operation 32 'load' 'k_1' <Predicate = true> <Delay = 0.00>
ST_1 : Operation 33 [1/1] (1.30ns)   --->   "%icmp_ln16 = icmp_eq  i4 %k_1, i4 8" [dct.cpp:16]   --->   Operation 33 'icmp' 'icmp_ln16' <Predicate = true> <Delay = 1.30> <CoreInst = "Cmp">   --->   Core 9 'Cmp' <Latency = 0> <II = 1> <Delay = 1.30> <FuncUnit> <Opcode : 'icmp'> <InPorts = 2> <OutPorts = 1>
ST_1 : Operation 34 [1/1] (0.00ns)   --->   "%empty = speclooptripcount i32 @_ssdm_op_SpecLoopTripCount, i64 8, i64 8, i64 8"   --->   Operation 34 'speclooptripcount' 'empty' <Predicate = true> <Delay = 0.00>
ST_1 : Operation 35 [1/1] (1.73ns)   --->   "%add_ln16 = add i4 %k_1, i4 1" [dct.cpp:16]   --->   Operation 35 'add' 'add_ln16' <Predicate = true> <Delay = 1.73> <CoreInst = "Adder">   --->   Core 1 'Adder' <Latency = 0> <II = 1> <Delay = 1.73> <FuncUnit> <Opcode : 'add' 'sub'> <InPorts = 2> <OutPorts = 1>
ST_1 : Operation 36 [1/1] (0.00ns)   --->   "%br_ln16 = br i1 %icmp_ln16, void %for.inc.split, void %for.end15" [dct.cpp:16]   --->   Operation 36 'br' 'br_ln16' <Predicate = true> <Delay = 0.00>
ST_1 : Operation 37 [1/1] (0.00ns)   --->   "%zext_ln16 = zext i4 %k_1" [dct.cpp:16]   --->   Operation 37 'zext' 'zext_ln16' <Predicate = (!icmp_ln16)> <Delay = 0.00>
ST_1 : Operation 38 [1/1] (0.00ns)   --->   "%dct_1d_short_short_dct_coeff_table_4_addr = getelementptr i15 %dct_1d_short_short_dct_coeff_table_4, i64 0, i64 %zext_ln16" [dct.cpp:19]   --->   Operation 38 'getelementptr' 'dct_1d_short_short_dct_coeff_table_4_addr' <Predicate = (!icmp_ln16)> <Delay = 0.00>
ST_1 : Operation 39 [2/2] (2.32ns)   --->   "%coeff_4 = load i3 %dct_1d_short_short_dct_coeff_table_4_addr" [dct.cpp:19]   --->   Operation 39 'load' 'coeff_4' <Predicate = (!icmp_ln16)> <Delay = 2.32> <CoreInst = "ROM">   --->   Core 95 'ROM' <Latency = 1> <II = 1> <Delay = 2.32> <Storage> <Opcode : 'load'> <Ports = 0> <Width = 15> <Depth = 8> <ROM>
ST_1 : Operation 40 [1/1] (0.00ns)   --->   "%dct_1d_short_short_dct_coeff_table_7_addr = getelementptr i15 %dct_1d_short_short_dct_coeff_table_7, i64 0, i64 %zext_ln16" [dct.cpp:19]   --->   Operation 40 'getelementptr' 'dct_1d_short_short_dct_coeff_table_7_addr' <Predicate = (!icmp_ln16)> <Delay = 0.00>
ST_1 : Operation 41 [2/2] (2.32ns)   --->   "%coeff_7 = load i3 %dct_1d_short_short_dct_coeff_table_7_addr" [dct.cpp:19]   --->   Operation 41 'load' 'coeff_7' <Predicate = (!icmp_ln16)> <Delay = 2.32> <CoreInst = "ROM">   --->   Core 95 'ROM' <Latency = 1> <II = 1> <Delay = 2.32> <Storage> <Opcode : 'load'> <Ports = 0> <Width = 15> <Depth = 8> <ROM>
ST_1 : Operation 42 [1/1] (1.58ns)   --->   "%store_ln16 = store i4 %add_ln16, i4 %k" [dct.cpp:16]   --->   Operation 42 'store' 'store_ln16' <Predicate = (!icmp_ln16)> <Delay = 1.58>

State 2 <SV = 1> <Delay = 4.47>
ST_2 : Operation 43 [1/1] (0.00ns)   --->   "%dct_1d_short_short_dct_coeff_table_addr = getelementptr i14 %dct_1d_short_short_dct_coeff_table, i64 0, i64 %zext_ln16" [dct.cpp:19]   --->   Operation 43 'getelementptr' 'dct_1d_short_short_dct_coeff_table_addr' <Predicate = true> <Delay = 0.00>
ST_2 : Operation 44 [2/2] (2.32ns)   --->   "%coeff = load i3 %dct_1d_short_short_dct_coeff_table_addr" [dct.cpp:19]   --->   Operation 44 'load' 'coeff' <Predicate = true> <Delay = 2.32> <CoreInst = "ROM">   --->   Core 95 'ROM' <Latency = 1> <II = 1> <Delay = 2.32> <Storage> <Opcode : 'load'> <Ports = 0> <Width = 14> <Depth = 8> <ROM>
ST_2 : Operation 45 [1/1] (0.00ns)   --->   "%dct_1d_short_short_dct_coeff_table_1_addr = getelementptr i15 %dct_1d_short_short_dct_coeff_table_1, i64 0, i64 %zext_ln16" [dct.cpp:19]   --->   Operation 45 'getelementptr' 'dct_1d_short_short_dct_coeff_table_1_addr' <Predicate = true> <Delay = 0.00>
ST_2 : Operation 46 [2/2] (2.32ns)   --->   "%coeff_1 = load i3 %dct_1d_short_short_dct_coeff_table_1_addr" [dct.cpp:19]   --->   Operation 46 'load' 'coeff_1' <Predicate = true> <Delay = 2.32> <CoreInst = "ROM">   --->   Core 95 'ROM' <Latency = 1> <II = 1> <Delay = 2.32> <Storage> <Opcode : 'load'> <Ports = 0> <Width = 15> <Depth = 8> <ROM>
ST_2 : Operation 47 [1/1] (0.00ns)   --->   "%dct_1d_short_short_dct_coeff_table_2_addr = getelementptr i15 %dct_1d_short_short_dct_coeff_table_2, i64 0, i64 %zext_ln16" [dct.cpp:19]   --->   Operation 47 'getelementptr' 'dct_1d_short_short_dct_coeff_table_2_addr' <Predicate = true> <Delay = 0.00>
ST_2 : Operation 48 [2/2] (2.32ns)   --->   "%coeff_2 = load i3 %dct_1d_short_short_dct_coeff_table_2_addr" [dct.cpp:19]   --->   Operation 48 'load' 'coeff_2' <Predicate = true> <Delay = 2.32> <CoreInst = "ROM">   --->   Core 95 'ROM' <Latency = 1> <II = 1> <Delay = 2.32> <Storage> <Opcode : 'load'> <Ports = 0> <Width = 15> <Depth = 8> <ROM>
ST_2 : Operation 49 [1/1] (0.00ns)   --->   "%dct_1d_short_short_dct_coeff_table_3_addr = getelementptr i15 %dct_1d_short_short_dct_coeff_table_3, i64 0, i64 %zext_ln16" [dct.cpp:19]   --->   Operation 49 'getelementptr' 'dct_1d_short_short_dct_coeff_table_3_addr' <Predicate = true> <Delay = 0.00>
ST_2 : Operation 50 [2/2] (2.32ns)   --->   "%coeff_3 = load i3 %dct_1d_short_short_dct_coeff_table_3_addr" [dct.cpp:19]   --->   Operation 50 'load' 'coeff_3' <Predicate = true> <Delay = 2.32> <CoreInst = "ROM">   --->   Core 95 'ROM' <Latency = 1> <II = 1> <Delay = 2.32> <Storage> <Opcode : 'load'> <Ports = 0> <Width = 15> <Depth = 8> <ROM>
ST_2 : Operation 51 [1/2] (2.32ns)   --->   "%coeff_4 = load i3 %dct_1d_short_short_dct_coeff_table_4_addr" [dct.cpp:19]   --->   Operation 51 'load' 'coeff_4' <Predicate = true> <Delay = 2.32> <CoreInst = "ROM">   --->   Core 95 'ROM' <Latency = 1> <II = 1> <Delay = 2.32> <Storage> <Opcode : 'load'> <Ports = 0> <Width = 15> <Depth = 8> <ROM>
ST_2 : Operation 52 [1/1] (0.00ns)   --->   "%sext_ln19_9 = sext i15 %coeff_4" [dct.cpp:19]   --->   Operation 52 'sext' 'sext_ln19_9' <Predicate = true> <Delay = 0.00>
ST_2 : Operation 53 [4/4] (2.15ns) (root node of the DSP)   --->   "%mul_ln19_3 = mul i29 %sext_ln19_9, i29 %sext_ln19_3" [dct.cpp:19]   --->   Operation 53 'mul' 'mul_ln19_3' <Predicate = true> <Delay = 2.15> <CoreInst = "DSP48">   --->   Core 119 'DSP48' <Latency = 3> <II = 1> <Delay = 2.15> <IPBlock> <Opcode : 'mul' 'add' 'sub' 'select'> <InPorts = 0> <OutPorts = 1> <Sync> <CReg>
ST_2 : Operation 54 [1/1] (0.00ns)   --->   "%dct_1d_short_short_dct_coeff_table_5_addr = getelementptr i15 %dct_1d_short_short_dct_coeff_table_5, i64 0, i64 %zext_ln16" [dct.cpp:19]   --->   Operation 54 'getelementptr' 'dct_1d_short_short_dct_coeff_table_5_addr' <Predicate = true> <Delay = 0.00>
ST_2 : Operation 55 [2/2] (2.32ns)   --->   "%coeff_5 = load i3 %dct_1d_short_short_dct_coeff_table_5_addr" [dct.cpp:19]   --->   Operation 55 'load' 'coeff_5' <Predicate = true> <Delay = 2.32> <CoreInst = "ROM">   --->   Core 95 'ROM' <Latency = 1> <II = 1> <Delay = 2.32> <Storage> <Opcode : 'load'> <Ports = 0> <Width = 15> <Depth = 8> <ROM>
ST_2 : Operation 56 [1/1] (0.00ns)   --->   "%dct_1d_short_short_dct_coeff_table_6_addr = getelementptr i15 %dct_1d_short_short_dct_coeff_table_6, i64 0, i64 %zext_ln16" [dct.cpp:19]   --->   Operation 56 'getelementptr' 'dct_1d_short_short_dct_coeff_table_6_addr' <Predicate = true> <Delay = 0.00>
ST_2 : Operation 57 [2/2] (2.32ns)   --->   "%coeff_6 = load i3 %dct_1d_short_short_dct_coeff_table_6_addr" [dct.cpp:19]   --->   Operation 57 'load' 'coeff_6' <Predicate = true> <Delay = 2.32> <CoreInst = "ROM">   --->   Core 95 'ROM' <Latency = 1> <II = 1> <Delay = 2.32> <Storage> <Opcode : 'load'> <Ports = 0> <Width = 15> <Depth = 8> <ROM>
ST_2 : Operation 58 [1/2] (2.32ns)   --->   "%coeff_7 = load i3 %dct_1d_short_short_dct_coeff_table_7_addr" [dct.cpp:19]   --->   Operation 58 'load' 'coeff_7' <Predicate = true> <Delay = 2.32> <CoreInst = "ROM">   --->   Core 95 'ROM' <Latency = 1> <II = 1> <Delay = 2.32> <Storage> <Opcode : 'load'> <Ports = 0> <Width = 15> <Depth = 8> <ROM>
ST_2 : Operation 59 [1/1] (0.00ns)   --->   "%sext_ln22_1 = sext i15 %coeff_7" [dct.cpp:22]   --->   Operation 59 'sext' 'sext_ln22_1' <Predicate = true> <Delay = 0.00>
ST_2 : Operation 60 [3/3] (1.05ns) (grouped into DSP with root node add_ln22_5)   --->   "%mul_ln22 = mul i29 %sext_ln22_1, i29 %sext_ln22" [dct.cpp:22]   --->   Operation 60 'mul' 'mul_ln22' <Predicate = true> <Delay = 1.05> <CoreInst = "DSP48">   --->   Core 119 'DSP48' <Latency = 3> <II = 1> <Delay = 2.15> <IPBlock> <Opcode : 'mul' 'add' 'sub' 'select'> <InPorts = 0> <OutPorts = 1> <Sync> <CReg>

State 3 <SV = 2> <Delay = 4.47>
ST_3 : Operation 61 [1/2] (2.32ns)   --->   "%coeff = load i3 %dct_1d_short_short_dct_coeff_table_addr" [dct.cpp:19]   --->   Operation 61 'load' 'coeff' <Predicate = true> <Delay = 2.32> <CoreInst = "ROM">   --->   Core 95 'ROM' <Latency = 1> <II = 1> <Delay = 2.32> <Storage> <Opcode : 'load'> <Ports = 0> <Width = 14> <Depth = 8> <ROM>
ST_3 : Operation 62 [1/1] (0.00ns)   --->   "%zext_ln8 = zext i14 %coeff" [dct.cpp:8]   --->   Operation 62 'zext' 'zext_ln8' <Predicate = true> <Delay = 0.00>
ST_3 : Operation 63 [4/4] (2.15ns) (root node of the DSP)   --->   "%mul_ln8 = mul i29 %zext_ln8, i29 %sext_ln8" [dct.cpp:8]   --->   Operation 63 'mul' 'mul_ln8' <Predicate = true> <Delay = 2.15> <CoreInst = "DSP48">   --->   Core 119 'DSP48' <Latency = 3> <II = 1> <Delay = 2.15> <IPBlock> <Opcode : 'mul' 'add' 'sub' 'select'> <InPorts = 0> <OutPorts = 1> <Sync> <CReg>
ST_3 : Operation 64 [1/2] (2.32ns)   --->   "%coeff_1 = load i3 %dct_1d_short_short_dct_coeff_table_1_addr" [dct.cpp:19]   --->   Operation 64 'load' 'coeff_1' <Predicate = true> <Delay = 2.32> <CoreInst = "ROM">   --->   Core 95 'ROM' <Latency = 1> <II = 1> <Delay = 2.32> <Storage> <Opcode : 'load'> <Ports = 0> <Width = 15> <Depth = 8> <ROM>
ST_3 : Operation 65 [1/2] (2.32ns)   --->   "%coeff_2 = load i3 %dct_1d_short_short_dct_coeff_table_2_addr" [dct.cpp:19]   --->   Operation 65 'load' 'coeff_2' <Predicate = true> <Delay = 2.32> <CoreInst = "ROM">   --->   Core 95 'ROM' <Latency = 1> <II = 1> <Delay = 2.32> <Storage> <Opcode : 'load'> <Ports = 0> <Width = 15> <Depth = 8> <ROM>
ST_3 : Operation 66 [1/1] (0.00ns)   --->   "%sext_ln19_7 = sext i15 %coeff_2" [dct.cpp:19]   --->   Operation 66 'sext' 'sext_ln19_7' <Predicate = true> <Delay = 0.00>
ST_3 : Operation 67 [4/4] (2.15ns) (root node of the DSP)   --->   "%mul_ln19_1 = mul i29 %sext_ln19_7, i29 %sext_ln19_1" [dct.cpp:19]   --->   Operation 67 'mul' 'mul_ln19_1' <Predicate = true> <Delay = 2.15> <CoreInst = "DSP48">   --->   Core 119 'DSP48' <Latency = 3> <II = 1> <Delay = 2.15> <IPBlock> <Opcode : 'mul' 'add' 'sub' 'select'> <InPorts = 0> <OutPorts = 1> <Sync> <CReg>
ST_3 : Operation 68 [1/2] (2.32ns)   --->   "%coeff_3 = load i3 %dct_1d_short_short_dct_coeff_table_3_addr" [dct.cpp:19]   --->   Operation 68 'load' 'coeff_3' <Predicate = true> <Delay = 2.32> <CoreInst = "ROM">   --->   Core 95 'ROM' <Latency = 1> <II = 1> <Delay = 2.32> <Storage> <Opcode : 'load'> <Ports = 0> <Width = 15> <Depth = 8> <ROM>
ST_3 : Operation 69 [3/4] (2.15ns) (root node of the DSP)   --->   "%mul_ln19_3 = mul i29 %sext_ln19_9, i29 %sext_ln19_3" [dct.cpp:19]   --->   Operation 69 'mul' 'mul_ln19_3' <Predicate = true> <Delay = 2.15> <CoreInst = "DSP48">   --->   Core 119 'DSP48' <Latency = 3> <II = 1> <Delay = 2.15> <IPBlock> <Opcode : 'mul' 'add' 'sub' 'select'> <InPorts = 0> <OutPorts = 1> <Sync> <CReg>
ST_3 : Operation 70 [1/2] (2.32ns)   --->   "%coeff_5 = load i3 %dct_1d_short_short_dct_coeff_table_5_addr" [dct.cpp:19]   --->   Operation 70 'load' 'coeff_5' <Predicate = true> <Delay = 2.32> <CoreInst = "ROM">   --->   Core 95 'ROM' <Latency = 1> <II = 1> <Delay = 2.32> <Storage> <Opcode : 'load'> <Ports = 0> <Width = 15> <Depth = 8> <ROM>
ST_3 : Operation 71 [1/1] (0.00ns)   --->   "%sext_ln19_10 = sext i15 %coeff_5" [dct.cpp:19]   --->   Operation 71 'sext' 'sext_ln19_10' <Predicate = true> <Delay = 0.00>
ST_3 : Operation 72 [3/3] (1.05ns) (grouped into DSP with root node add_ln22_4)   --->   "%mul_ln19_4 = mul i29 %sext_ln19_10, i29 %sext_ln19_4" [dct.cpp:19]   --->   Operation 72 'mul' 'mul_ln19_4' <Predicate = true> <Delay = 1.05> <CoreInst = "DSP48">   --->   Core 119 'DSP48' <Latency = 3> <II = 1> <Delay = 2.15> <IPBlock> <Opcode : 'mul' 'add' 'sub' 'select'> <InPorts = 0> <OutPorts = 1> <Sync> <CReg>
ST_3 : Operation 73 [1/2] (2.32ns)   --->   "%coeff_6 = load i3 %dct_1d_short_short_dct_coeff_table_6_addr" [dct.cpp:19]   --->   Operation 73 'load' 'coeff_6' <Predicate = true> <Delay = 2.32> <CoreInst = "ROM">   --->   Core 95 'ROM' <Latency = 1> <II = 1> <Delay = 2.32> <Storage> <Opcode : 'load'> <Ports = 0> <Width = 15> <Depth = 8> <ROM>
ST_3 : Operation 74 [1/1] (0.00ns)   --->   "%sext_ln19_11 = sext i15 %coeff_6" [dct.cpp:19]   --->   Operation 74 'sext' 'sext_ln19_11' <Predicate = true> <Delay = 0.00>
ST_3 : Operation 75 [3/3] (1.05ns) (grouped into DSP with root node add_ln22_6)   --->   "%mul_ln19_5 = mul i29 %sext_ln19_11, i29 %sext_ln19_5" [dct.cpp:19]   --->   Operation 75 'mul' 'mul_ln19_5' <Predicate = true> <Delay = 1.05> <CoreInst = "DSP48">   --->   Core 119 'DSP48' <Latency = 3> <II = 1> <Delay = 2.15> <IPBlock> <Opcode : 'mul' 'add' 'sub' 'select'> <InPorts = 0> <OutPorts = 1> <Sync> <CReg>
ST_3 : Operation 76 [2/3] (1.05ns) (grouped into DSP with root node add_ln22_5)   --->   "%mul_ln22 = mul i29 %sext_ln22_1, i29 %sext_ln22" [dct.cpp:22]   --->   Operation 76 'mul' 'mul_ln22' <Predicate = true> <Delay = 1.05> <CoreInst = "DSP48">   --->   Core 119 'DSP48' <Latency = 3> <II = 1> <Delay = 2.15> <IPBlock> <Opcode : 'mul' 'add' 'sub' 'select'> <InPorts = 0> <OutPorts = 1> <Sync> <CReg>

State 4 <SV = 3> <Delay = 2.15>
ST_4 : Operation 77 [3/4] (2.15ns) (root node of the DSP)   --->   "%mul_ln8 = mul i29 %zext_ln8, i29 %sext_ln8" [dct.cpp:8]   --->   Operation 77 'mul' 'mul_ln8' <Predicate = true> <Delay = 2.15> <CoreInst = "DSP48">   --->   Core 119 'DSP48' <Latency = 3> <II = 1> <Delay = 2.15> <IPBlock> <Opcode : 'mul' 'add' 'sub' 'select'> <InPorts = 0> <OutPorts = 1> <Sync> <CReg>
ST_4 : Operation 78 [1/1] (0.00ns)   --->   "%sext_ln19_6 = sext i15 %coeff_1" [dct.cpp:19]   --->   Operation 78 'sext' 'sext_ln19_6' <Predicate = true> <Delay = 0.00>
ST_4 : Operation 79 [3/3] (1.05ns) (grouped into DSP with root node add_ln22_1)   --->   "%mul_ln19 = mul i29 %sext_ln19_6, i29 %sext_ln19" [dct.cpp:19]   --->   Operation 79 'mul' 'mul_ln19' <Predicate = true> <Delay = 1.05> <CoreInst = "DSP48">   --->   Core 119 'DSP48' <Latency = 3> <II = 1> <Delay = 2.15> <IPBlock> <Opcode : 'mul' 'add' 'sub' 'select'> <InPorts = 0> <OutPorts = 1> <Sync> <CReg>
ST_4 : Operation 80 [3/4] (2.15ns) (root node of the DSP)   --->   "%mul_ln19_1 = mul i29 %sext_ln19_7, i29 %sext_ln19_1" [dct.cpp:19]   --->   Operation 80 'mul' 'mul_ln19_1' <Predicate = true> <Delay = 2.15> <CoreInst = "DSP48">   --->   Core 119 'DSP48' <Latency = 3> <II = 1> <Delay = 2.15> <IPBlock> <Opcode : 'mul' 'add' 'sub' 'select'> <InPorts = 0> <OutPorts = 1> <Sync> <CReg>
ST_4 : Operation 81 [1/1] (0.00ns)   --->   "%sext_ln19_8 = sext i15 %coeff_3" [dct.cpp:19]   --->   Operation 81 'sext' 'sext_ln19_8' <Predicate = true> <Delay = 0.00>
ST_4 : Operation 82 [3/3] (1.05ns) (grouped into DSP with root node add_ln22_2)   --->   "%mul_ln19_2 = mul i29 %sext_ln19_8, i29 %sext_ln19_2" [dct.cpp:19]   --->   Operation 82 'mul' 'mul_ln19_2' <Predicate = true> <Delay = 1.05> <CoreInst = "DSP48">   --->   Core 119 'DSP48' <Latency = 3> <II = 1> <Delay = 2.15> <IPBlock> <Opcode : 'mul' 'add' 'sub' 'select'> <InPorts = 0> <OutPorts = 1> <Sync> <CReg>
ST_4 : Operation 83 [2/4] (2.15ns) (root node of the DSP)   --->   "%mul_ln19_3 = mul i29 %sext_ln19_9, i29 %sext_ln19_3" [dct.cpp:19]   --->   Operation 83 'mul' 'mul_ln19_3' <Predicate = true> <Delay = 2.15> <CoreInst = "DSP48">   --->   Core 119 'DSP48' <Latency = 3> <II = 1> <Delay = 2.15> <IPBlock> <Opcode : 'mul' 'add' 'sub' 'select'> <InPorts = 0> <OutPorts = 1> <Sync> <CReg>
ST_4 : Operation 84 [2/3] (1.05ns) (grouped into DSP with root node add_ln22_4)   --->   "%mul_ln19_4 = mul i29 %sext_ln19_10, i29 %sext_ln19_4" [dct.cpp:19]   --->   Operation 84 'mul' 'mul_ln19_4' <Predicate = true> <Delay = 1.05> <CoreInst = "DSP48">   --->   Core 119 'DSP48' <Latency = 3> <II = 1> <Delay = 2.15> <IPBlock> <Opcode : 'mul' 'add' 'sub' 'select'> <InPorts = 0> <OutPorts = 1> <Sync> <CReg>
ST_4 : Operation 85 [2/3] (1.05ns) (grouped into DSP with root node add_ln22_6)   --->   "%mul_ln19_5 = mul i29 %sext_ln19_11, i29 %sext_ln19_5" [dct.cpp:19]   --->   Operation 85 'mul' 'mul_ln19_5' <Predicate = true> <Delay = 1.05> <CoreInst = "DSP48">   --->   Core 119 'DSP48' <Latency = 3> <II = 1> <Delay = 2.15> <IPBlock> <Opcode : 'mul' 'add' 'sub' 'select'> <InPorts = 0> <OutPorts = 1> <Sync> <CReg>
ST_4 : Operation 86 [1/3] (0.00ns) (grouped into DSP with root node add_ln22_5)   --->   "%mul_ln22 = mul i29 %sext_ln22_1, i29 %sext_ln22" [dct.cpp:22]   --->   Operation 86 'mul' 'mul_ln22' <Predicate = true> <Delay = 0.00> <CoreInst = "DSP48">   --->   Core 119 'DSP48' <Latency = 3> <II = 1> <Delay = 2.15> <IPBlock> <Opcode : 'mul' 'add' 'sub' 'select'> <InPorts = 0> <OutPorts = 1> <Sync> <CReg>
ST_4 : Operation 87 [2/2] (2.10ns) (root node of the DSP)   --->   "%add_ln22_5 = add i29 %mul_ln22, i29 4096" [dct.cpp:22]   --->   Operation 87 'add' 'add_ln22_5' <Predicate = true> <Delay = 2.10> <CoreInst = "DSP48">   --->   Core 119 'DSP48' <Latency = 3> <II = 1> <Delay = 2.15> <IPBlock> <Opcode : 'mul' 'add' 'sub' 'select'> <InPorts = 0> <OutPorts = 1> <Sync> <CReg>

State 5 <SV = 4> <Delay = 4.20>
ST_5 : Operation 88 [2/4] (2.15ns) (root node of the DSP)   --->   "%mul_ln8 = mul i29 %zext_ln8, i29 %sext_ln8" [dct.cpp:8]   --->   Operation 88 'mul' 'mul_ln8' <Predicate = true> <Delay = 2.15> <CoreInst = "DSP48">   --->   Core 119 'DSP48' <Latency = 3> <II = 1> <Delay = 2.15> <IPBlock> <Opcode : 'mul' 'add' 'sub' 'select'> <InPorts = 0> <OutPorts = 1> <Sync> <CReg>
ST_5 : Operation 89 [2/3] (1.05ns) (grouped into DSP with root node add_ln22_1)   --->   "%mul_ln19 = mul i29 %sext_ln19_6, i29 %sext_ln19" [dct.cpp:19]   --->   Operation 89 'mul' 'mul_ln19' <Predicate = true> <Delay = 1.05> <CoreInst = "DSP48">   --->   Core 119 'DSP48' <Latency = 3> <II = 1> <Delay = 2.15> <IPBlock> <Opcode : 'mul' 'add' 'sub' 'select'> <InPorts = 0> <OutPorts = 1> <Sync> <CReg>
ST_5 : Operation 90 [2/4] (2.15ns) (root node of the DSP)   --->   "%mul_ln19_1 = mul i29 %sext_ln19_7, i29 %sext_ln19_1" [dct.cpp:19]   --->   Operation 90 'mul' 'mul_ln19_1' <Predicate = true> <Delay = 2.15> <CoreInst = "DSP48">   --->   Core 119 'DSP48' <Latency = 3> <II = 1> <Delay = 2.15> <IPBlock> <Opcode : 'mul' 'add' 'sub' 'select'> <InPorts = 0> <OutPorts = 1> <Sync> <CReg>
ST_5 : Operation 91 [2/3] (1.05ns) (grouped into DSP with root node add_ln22_2)   --->   "%mul_ln19_2 = mul i29 %sext_ln19_8, i29 %sext_ln19_2" [dct.cpp:19]   --->   Operation 91 'mul' 'mul_ln19_2' <Predicate = true> <Delay = 1.05> <CoreInst = "DSP48">   --->   Core 119 'DSP48' <Latency = 3> <II = 1> <Delay = 2.15> <IPBlock> <Opcode : 'mul' 'add' 'sub' 'select'> <InPorts = 0> <OutPorts = 1> <Sync> <CReg>
ST_5 : Operation 92 [1/4] (0.00ns) (root node of the DSP)   --->   "%mul_ln19_3 = mul i29 %sext_ln19_9, i29 %sext_ln19_3" [dct.cpp:19]   --->   Operation 92 'mul' 'mul_ln19_3' <Predicate = true> <Delay = 0.00> <CoreInst = "DSP48">   --->   Core 119 'DSP48' <Latency = 3> <II = 1> <Delay = 2.15> <IPBlock> <Opcode : 'mul' 'add' 'sub' 'select'> <InPorts = 0> <OutPorts = 1> <Sync> <CReg>
ST_5 : Operation 93 [1/3] (0.00ns) (grouped into DSP with root node add_ln22_4)   --->   "%mul_ln19_4 = mul i29 %sext_ln19_10, i29 %sext_ln19_4" [dct.cpp:19]   --->   Operation 93 'mul' 'mul_ln19_4' <Predicate = true> <Delay = 0.00> <CoreInst = "DSP48">   --->   Core 119 'DSP48' <Latency = 3> <II = 1> <Delay = 2.15> <IPBlock> <Opcode : 'mul' 'add' 'sub' 'select'> <InPorts = 0> <OutPorts = 1> <Sync> <CReg>
ST_5 : Operation 94 [1/3] (0.00ns) (grouped into DSP with root node add_ln22_6)   --->   "%mul_ln19_5 = mul i29 %sext_ln19_11, i29 %sext_ln19_5" [dct.cpp:19]   --->   Operation 94 'mul' 'mul_ln19_5' <Predicate = true> <Delay = 0.00> <CoreInst = "DSP48">   --->   Core 119 'DSP48' <Latency = 3> <II = 1> <Delay = 2.15> <IPBlock> <Opcode : 'mul' 'add' 'sub' 'select'> <InPorts = 0> <OutPorts = 1> <Sync> <CReg>
ST_5 : Operation 95 [2/2] (2.10ns) (root node of the DSP)   --->   "%add_ln22_4 = add i29 %mul_ln19_3, i29 %mul_ln19_4" [dct.cpp:22]   --->   Operation 95 'add' 'add_ln22_4' <Predicate = true> <Delay = 2.10> <CoreInst = "DSP48">   --->   Core 119 'DSP48' <Latency = 3> <II = 1> <Delay = 2.15> <IPBlock> <Opcode : 'mul' 'add' 'sub' 'select'> <InPorts = 0> <OutPorts = 1> <Sync> <CReg>
ST_5 : Operation 96 [1/2] (2.10ns) (root node of the DSP)   --->   "%add_ln22_5 = add i29 %mul_ln22, i29 4096" [dct.cpp:22]   --->   Operation 96 'add' 'add_ln22_5' <Predicate = true> <Delay = 2.10> <CoreInst = "DSP48">   --->   Core 119 'DSP48' <Latency = 3> <II = 1> <Delay = 2.15> <IPBlock> <Opcode : 'mul' 'add' 'sub' 'select'> <InPorts = 0> <OutPorts = 1> <Sync> <CReg>
ST_5 : Operation 97 [2/2] (2.10ns) (root node of the DSP)   --->   "%add_ln22_6 = add i29 %add_ln22_5, i29 %mul_ln19_5" [dct.cpp:22]   --->   Operation 97 'add' 'add_ln22_6' <Predicate = true> <Delay = 2.10> <CoreInst = "DSP48">   --->   Core 119 'DSP48' <Latency = 3> <II = 1> <Delay = 2.15> <IPBlock> <Opcode : 'mul' 'add' 'sub' 'select'> <InPorts = 0> <OutPorts = 1> <Sync> <CReg>

State 6 <SV = 5> <Delay = 4.56>
ST_6 : Operation 98 [1/4] (0.00ns) (root node of the DSP)   --->   "%mul_ln8 = mul i29 %zext_ln8, i29 %sext_ln8" [dct.cpp:8]   --->   Operation 98 'mul' 'mul_ln8' <Predicate = true> <Delay = 0.00> <CoreInst = "DSP48">   --->   Core 119 'DSP48' <Latency = 3> <II = 1> <Delay = 2.15> <IPBlock> <Opcode : 'mul' 'add' 'sub' 'select'> <InPorts = 0> <OutPorts = 1> <Sync> <CReg>
ST_6 : Operation 99 [1/3] (0.00ns) (grouped into DSP with root node add_ln22_1)   --->   "%mul_ln19 = mul i29 %sext_ln19_6, i29 %sext_ln19" [dct.cpp:19]   --->   Operation 99 'mul' 'mul_ln19' <Predicate = true> <Delay = 0.00> <CoreInst = "DSP48">   --->   Core 119 'DSP48' <Latency = 3> <II = 1> <Delay = 2.15> <IPBlock> <Opcode : 'mul' 'add' 'sub' 'select'> <InPorts = 0> <OutPorts = 1> <Sync> <CReg>
ST_6 : Operation 100 [1/4] (0.00ns) (root node of the DSP)   --->   "%mul_ln19_1 = mul i29 %sext_ln19_7, i29 %sext_ln19_1" [dct.cpp:19]   --->   Operation 100 'mul' 'mul_ln19_1' <Predicate = true> <Delay = 0.00> <CoreInst = "DSP48">   --->   Core 119 'DSP48' <Latency = 3> <II = 1> <Delay = 2.15> <IPBlock> <Opcode : 'mul' 'add' 'sub' 'select'> <InPorts = 0> <OutPorts = 1> <Sync> <CReg>
ST_6 : Operation 101 [1/3] (0.00ns) (grouped into DSP with root node add_ln22_2)   --->   "%mul_ln19_2 = mul i29 %sext_ln19_8, i29 %sext_ln19_2" [dct.cpp:19]   --->   Operation 101 'mul' 'mul_ln19_2' <Predicate = true> <Delay = 0.00> <CoreInst = "DSP48">   --->   Core 119 'DSP48' <Latency = 3> <II = 1> <Delay = 2.15> <IPBlock> <Opcode : 'mul' 'add' 'sub' 'select'> <InPorts = 0> <OutPorts = 1> <Sync> <CReg>
ST_6 : Operation 102 [2/2] (2.10ns) (root node of the DSP)   --->   "%add_ln22_1 = add i29 %mul_ln8, i29 %mul_ln19" [dct.cpp:22]   --->   Operation 102 'add' 'add_ln22_1' <Predicate = true> <Delay = 2.10> <CoreInst = "DSP48">   --->   Core 119 'DSP48' <Latency = 3> <II = 1> <Delay = 2.15> <IPBlock> <Opcode : 'mul' 'add' 'sub' 'select'> <InPorts = 0> <OutPorts = 1> <Sync> <CReg>
ST_6 : Operation 103 [2/2] (2.10ns) (root node of the DSP)   --->   "%add_ln22_2 = add i29 %mul_ln19_1, i29 %mul_ln19_2" [dct.cpp:22]   --->   Operation 103 'add' 'add_ln22_2' <Predicate = true> <Delay = 2.10> <CoreInst = "DSP48">   --->   Core 119 'DSP48' <Latency = 3> <II = 1> <Delay = 2.15> <IPBlock> <Opcode : 'mul' 'add' 'sub' 'select'> <InPorts = 0> <OutPorts = 1> <Sync> <CReg>
ST_6 : Operation 104 [1/2] (2.10ns) (root node of the DSP)   --->   "%add_ln22_4 = add i29 %mul_ln19_3, i29 %mul_ln19_4" [dct.cpp:22]   --->   Operation 104 'add' 'add_ln22_4' <Predicate = true> <Delay = 2.10> <CoreInst = "DSP48">   --->   Core 119 'DSP48' <Latency = 3> <II = 1> <Delay = 2.15> <IPBlock> <Opcode : 'mul' 'add' 'sub' 'select'> <InPorts = 0> <OutPorts = 1> <Sync> <CReg>
ST_6 : Operation 105 [1/2] (2.10ns) (root node of the DSP)   --->   "%add_ln22_6 = add i29 %add_ln22_5, i29 %mul_ln19_5" [dct.cpp:22]   --->   Operation 105 'add' 'add_ln22_6' <Predicate = true> <Delay = 2.10> <CoreInst = "DSP48">   --->   Core 119 'DSP48' <Latency = 3> <II = 1> <Delay = 2.15> <IPBlock> <Opcode : 'mul' 'add' 'sub' 'select'> <InPorts = 0> <OutPorts = 1> <Sync> <CReg>
ST_6 : Operation 106 [1/1] (2.46ns)   --->   "%add_ln22_7 = add i29 %add_ln22_6, i29 %add_ln22_4" [dct.cpp:22]   --->   Operation 106 'add' 'add_ln22_7' <Predicate = true> <Delay = 2.46> <CoreInst = "Adder">   --->   Core 1 'Adder' <Latency = 0> <II = 1> <Delay = 2.46> <FuncUnit> <Opcode : 'add' 'sub'> <InPorts = 2> <OutPorts = 1>

State 7 <SV = 6> <Delay = 6.38>
ST_7 : Operation 107 [1/2] (2.10ns) (root node of the DSP)   --->   "%add_ln22_1 = add i29 %mul_ln8, i29 %mul_ln19" [dct.cpp:22]   --->   Operation 107 'add' 'add_ln22_1' <Predicate = true> <Delay = 2.10> <CoreInst = "DSP48">   --->   Core 119 'DSP48' <Latency = 3> <II = 1> <Delay = 2.15> <IPBlock> <Opcode : 'mul' 'add' 'sub' 'select'> <InPorts = 0> <OutPorts = 1> <Sync> <CReg>
ST_7 : Operation 108 [1/2] (2.10ns) (root node of the DSP)   --->   "%add_ln22_2 = add i29 %mul_ln19_1, i29 %mul_ln19_2" [dct.cpp:22]   --->   Operation 108 'add' 'add_ln22_2' <Predicate = true> <Delay = 2.10> <CoreInst = "DSP48">   --->   Core 119 'DSP48' <Latency = 3> <II = 1> <Delay = 2.15> <IPBlock> <Opcode : 'mul' 'add' 'sub' 'select'> <InPorts = 0> <OutPorts = 1> <Sync> <CReg>
ST_7 : Operation 109 [1/1] (0.00ns) (grouped into TernaryAdder)   --->   "%add_ln22_3 = add i29 %add_ln22_2, i29 %add_ln22_1" [dct.cpp:22]   --->   Operation 109 'add' 'add_ln22_3' <Predicate = true> <Delay = 0.00> <CoreInst = "TAddSub">   --->   Core 10 'TAddSub' <Latency = 0> <II = 1> <Delay = 2.14> <IPBlock> <Opcode : 'add' 'sub'> <InPorts = 3> <OutPorts = 1> <Sync> <CReg>
ST_7 : Operation 110 [1/1] (4.28ns) (root node of TernaryAdder)   --->   "%add_ln22 = add i29 %add_ln22_7, i29 %add_ln22_3" [dct.cpp:22]   --->   Operation 110 'add' 'add_ln22' <Predicate = true> <Delay = 4.28> <CoreInst = "TAddSub">   --->   Core 10 'TAddSub' <Latency = 0> <II = 1> <Delay = 2.14> <IPBlock> <Opcode : 'add' 'sub'> <InPorts = 3> <OutPorts = 1> <Sync> <CReg>
ST_7 : Operation 111 [1/1] (0.00ns)   --->   "%trunc_ln = partselect i16 @_ssdm_op_PartSelect.i16.i29.i32.i32, i29 %add_ln22, i32 13, i32 28" [dct.cpp:22]   --->   Operation 111 'partselect' 'trunc_ln' <Predicate = true> <Delay = 0.00>
ST_7 : Operation 120 [1/1] (0.00ns)   --->   "%ret_ln24 = ret" [dct.cpp:24]   --->   Operation 120 'ret' 'ret_ln24' <Predicate = (icmp_ln16)> <Delay = 0.00>

State 8 <SV = 7> <Delay = 5.07>
ST_8 : Operation 112 [1/1] (0.00ns)   --->   "%zext_ln22 = zext i4 %k_1" [dct.cpp:22]   --->   Operation 112 'zext' 'zext_ln22' <Predicate = true> <Delay = 0.00>
ST_8 : Operation 113 [1/1] (1.82ns)   --->   "%add_ln22_8 = add i6 %tmp, i6 %zext_ln22" [dct.cpp:22]   --->   Operation 113 'add' 'add_ln22_8' <Predicate = true> <Delay = 1.82> <CoreInst = "Adder">   --->   Core 1 'Adder' <Latency = 0> <II = 1> <Delay = 1.82> <FuncUnit> <Opcode : 'add' 'sub'> <InPorts = 2> <OutPorts = 1>
ST_8 : Operation 114 [1/1] (0.00ns)   --->   "%zext_ln22_1 = zext i6 %add_ln22_8" [dct.cpp:22]   --->   Operation 114 'zext' 'zext_ln22_1' <Predicate = true> <Delay = 0.00>
ST_8 : Operation 115 [1/1] (0.00ns)   --->   "%dst_addr = getelementptr i16 %dst, i64 0, i64 %zext_ln22_1" [dct.cpp:22]   --->   Operation 115 'getelementptr' 'dst_addr' <Predicate = true> <Delay = 0.00>
ST_8 : Operation 116 [1/1] (0.00ns)   --->   "%specpipeline_ln11 = specpipeline void @_ssdm_op_SpecPipeline, i32 4294967295, i32 0, i32 0, i32 0, void @empty_0" [C:/Users/Richard/Desktop/Course/AAHLS/labs/labA/ug871-design-files-ch6/dct_prj/solution4/directives.tcl:11]   --->   Operation 116 'specpipeline' 'specpipeline_ln11' <Predicate = true> <Delay = 0.00>
ST_8 : Operation 117 [1/1] (0.00ns)   --->   "%specloopname_ln7 = specloopname void @_ssdm_op_SpecLoopName, void @empty_8" [dct.cpp:7]   --->   Operation 117 'specloopname' 'specloopname_ln7' <Predicate = true> <Delay = 0.00>
ST_8 : Operation 118 [1/1] (3.25ns)   --->   "%store_ln22 = store i16 %trunc_ln, i6 %dst_addr" [dct.cpp:22]   --->   Operation 118 'store' 'store_ln22' <Predicate = true> <Delay = 3.25> <CoreInst = "RAM">   --->   Core 82 'RAM' <Latency = 1> <II = 1> <Delay = 3.25> <Storage> <Opcode : 'load' 'store'> <Ports = 2> <Width = 16> <Depth = 64> <RAM>
ST_8 : Operation 119 [1/1] (0.00ns)   --->   "%br_ln16 = br void %for.inc" [dct.cpp:16]   --->   Operation 119 'br' 'br_ln16' <Predicate = true> <Delay = 0.00>


============================================================
+ Verbose Summary: Timing violations
============================================================
Target clock period: 10ns, clock uncertainty: 2.7ns.

 <State 1>: 3.32ns
The critical path consists of the following:
	'alloca' operation ('k') [19]  (0 ns)
	'load' operation ('k', dct.cpp:16) on local variable 'k' [41]  (0 ns)
	'add' operation ('add_ln16', dct.cpp:16) [44]  (1.74 ns)
	'store' operation ('store_ln16', dct.cpp:16) of variable 'add_ln16', dct.cpp:16 on local variable 'k' [96]  (1.59 ns)

 <State 2>: 4.47ns
The critical path consists of the following:
	'load' operation ('coeff', dct.cpp:19) on array 'dct_1d_short_short_dct_coeff_table_4' [71]  (2.32 ns)
	'mul' operation of DSP[73] ('mul_ln19_3', dct.cpp:19) [73]  (2.15 ns)

 <State 3>: 4.47ns
The critical path consists of the following:
	'load' operation ('coeff', dct.cpp:19) on array 'dct_1d_short_short_dct_coeff_table' [55]  (2.32 ns)
	'mul' operation of DSP[57] ('mul_ln8', dct.cpp:8) [57]  (2.15 ns)

 <State 4>: 2.15ns
The critical path consists of the following:
	'mul' operation of DSP[57] ('mul_ln8', dct.cpp:8) [57]  (2.15 ns)

 <State 5>: 4.2ns
The critical path consists of the following:
	'add' operation of DSP[90] ('add_ln22_5', dct.cpp:22) [90]  (2.1 ns)
	'add' operation of DSP[91] ('add_ln22_6', dct.cpp:22) [91]  (2.1 ns)

 <State 6>: 4.56ns
The critical path consists of the following:
	'add' operation of DSP[89] ('add_ln22_4', dct.cpp:22) [89]  (2.1 ns)
	'add' operation ('add_ln22_7', dct.cpp:22) [92]  (2.46 ns)

 <State 7>: 6.38ns
The critical path consists of the following:
	'add' operation of DSP[86] ('add_ln22_1', dct.cpp:22) [86]  (2.1 ns)
	'add' operation ('add_ln22_3', dct.cpp:22) [88]  (0 ns)
	'add' operation ('add_ln22', dct.cpp:22) [93]  (4.28 ns)

 <State 8>: 5.08ns
The critical path consists of the following:
	'add' operation ('add_ln22_8', dct.cpp:22) [49]  (1.83 ns)
	'getelementptr' operation ('dst_addr', dct.cpp:22) [51]  (0 ns)
	'store' operation ('store_ln22', dct.cpp:22) of variable 'trunc_ln', dct.cpp:22 on array 'dst' [95]  (3.25 ns)


============================================================
+ Verbose Summary: Binding
============================================================
N/A
* FSMD analyzer results:
  - Output states:
 - Input state : 
  - Chain level:
	State 1
	State 2
	State 3
	State 4
	State 5
	State 6
	State 7
	State 8


============================================================
+ Verbose Summary: Datapath Resource usage 
============================================================
N/A
