

================================================================
== Vitis HLS Report for 'dct_2d_Pipeline_Xpose_Col_Outer_Loop_Xpose_Col_Inner_Loop'
================================================================
* Date:           Mon Mar  6 13:53:03 2023

* Version:        2022.1 (Build 3526262 on Mon Apr 18 15:48:16 MDT 2022)
* Project:        dct_prj
* Solution:       solution5 (Vivado IP Flow Target)
* Product family: zynq
* Target device:  xc7z020-clg400-1


================================================================
== Performance Estimates
================================================================
+ Timing: 
    * Summary: 
    +--------+----------+----------+------------+
    |  Clock |  Target  | Estimated| Uncertainty|
    +--------+----------+----------+------------+
    |ap_clk  |  10.00 ns|  6.508 ns|     2.70 ns|
    +--------+----------+----------+------------+

+ Latency: 
    * Summary: 
    +---------+---------+----------+----------+-----+-----+---------+
    |  Latency (cycles) |  Latency (absolute) |  Interval | Pipeline|
    |   min   |   max   |    min   |    max   | min | max |   Type  |
    +---------+---------+----------+----------+-----+-----+---------+
    |       67|       67|  0.670 us|  0.670 us|   67|   67|       no|
    +---------+---------+----------+----------+-----+-----+---------+

    + Detail: 
        * Instance: 
        N/A

        * Loop: 
        +---------------------------------------------+---------+---------+----------+-----------+-----------+------+----------+
        |                                             |  Latency (cycles) | Iteration|  Initiation Interval  | Trip |          |
        |                  Loop Name                  |   min   |   max   |  Latency |  achieved |   target  | Count| Pipelined|
        +---------------------------------------------+---------+---------+----------+-----------+-----------+------+----------+
        |- Xpose_Col_Outer_Loop_Xpose_Col_Inner_Loop  |       65|       65|         3|          1|          1|    64|       yes|
        +---------------------------------------------+---------+---------+----------+-----------+-----------+------+----------+

============================================================
+ Verbose Summary: Synthesis Manager
============================================================
InlineROM: 1
ExposeGlobal: 0
============================================================
+ Verbose Summary: CDFG Model
============================================================
IsTopModel: 0
ResetActiveHigh: 1
IsCombinational: 0
IsDatapathOnly: 0
HasWiredReturn: 1
HasMFsm: 2
HasVarLatency: 1
IsPipeline: 0
IsRtlPipelined: 0
IsInstanceOverlapped: 0
IsDontTouch: 0
HasImplIP: 0
IsGatedGlobalClock: 0

+ Individual pipeline summary: 
  * Pipeline-0: initiation interval (II) = 1, depth = 3


============================================================
+ Verbose Summary: Schedule
============================================================
* Number of FSM states : 3
* Pipeline : 1
  Pipeline-0 : II = 1, D = 3, States = { 1 2 3 }
* Dataflow Pipeline: 0

* FSM state transitions: 
1 --> 2 
2 --> 3 
3 --> 

* FSM state operations: 

State 1 <SV = 0> <Delay = 5.64>
ST_1 : Operation 6 [1/1] (0.00ns)   --->   "%i = alloca i32 1"   --->   Operation 6 'alloca' 'i' <Predicate = true> <Delay = 0.00>
ST_1 : Operation 7 [1/1] (0.00ns)   --->   "%j = alloca i32 1"   --->   Operation 7 'alloca' 'j' <Predicate = true> <Delay = 0.00>
ST_1 : Operation 8 [1/1] (0.00ns)   --->   "%indvar_flatten14 = alloca i32 1"   --->   Operation 8 'alloca' 'indvar_flatten14' <Predicate = true> <Delay = 0.00>
ST_1 : Operation 9 [1/1] (1.58ns)   --->   "%store_ln0 = store i7 0, i7 %indvar_flatten14"   --->   Operation 9 'store' 'store_ln0' <Predicate = true> <Delay = 1.58>
ST_1 : Operation 10 [1/1] (1.58ns)   --->   "%store_ln0 = store i4 0, i4 %j"   --->   Operation 10 'store' 'store_ln0' <Predicate = true> <Delay = 1.58>
ST_1 : Operation 11 [1/1] (1.58ns)   --->   "%store_ln0 = store i4 0, i4 %i"   --->   Operation 11 'store' 'store_ln0' <Predicate = true> <Delay = 1.58>
ST_1 : Operation 12 [1/1] (0.00ns)   --->   "%br_ln0 = br void %for.inc50"   --->   Operation 12 'br' 'br_ln0' <Predicate = true> <Delay = 0.00>
ST_1 : Operation 13 [1/1] (0.00ns)   --->   "%indvar_flatten14_load = load i7 %indvar_flatten14" [dct.cpp:61]   --->   Operation 13 'load' 'indvar_flatten14_load' <Predicate = true> <Delay = 0.00>
ST_1 : Operation 14 [1/1] (1.48ns)   --->   "%icmp_ln61 = icmp_eq  i7 %indvar_flatten14_load, i7 64" [dct.cpp:61]   --->   Operation 14 'icmp' 'icmp_ln61' <Predicate = true> <Delay = 1.48> <CoreInst = "Cmp">   --->   Core 9 'Cmp' <Latency = 0> <II = 1> <Delay = 1.48> <FuncUnit> <Opcode : 'icmp'> <InPorts = 2> <OutPorts = 1>
ST_1 : Operation 15 [1/1] (1.87ns)   --->   "%add_ln61_1 = add i7 %indvar_flatten14_load, i7 1" [dct.cpp:61]   --->   Operation 15 'add' 'add_ln61_1' <Predicate = true> <Delay = 1.87> <CoreInst = "Adder">   --->   Core 1 'Adder' <Latency = 0> <II = 1> <Delay = 1.87> <FuncUnit> <Opcode : 'add' 'sub'> <InPorts = 2> <OutPorts = 1>
ST_1 : Operation 16 [1/1] (0.00ns)   --->   "%br_ln61 = br i1 %icmp_ln61, void %for.inc53, void %for.end55.exitStub" [dct.cpp:61]   --->   Operation 16 'br' 'br_ln61' <Predicate = true> <Delay = 0.00>
ST_1 : Operation 17 [1/1] (0.00ns)   --->   "%i_load = load i4 %i" [dct.cpp:63]   --->   Operation 17 'load' 'i_load' <Predicate = (!icmp_ln61)> <Delay = 0.00>
ST_1 : Operation 18 [1/1] (0.00ns)   --->   "%j_load = load i4 %j" [dct.cpp:61]   --->   Operation 18 'load' 'j_load' <Predicate = (!icmp_ln61)> <Delay = 0.00>
ST_1 : Operation 19 [1/1] (1.73ns)   --->   "%add_ln61 = add i4 %j_load, i4 1" [dct.cpp:61]   --->   Operation 19 'add' 'add_ln61' <Predicate = (!icmp_ln61)> <Delay = 1.73> <CoreInst = "Adder">   --->   Core 1 'Adder' <Latency = 0> <II = 1> <Delay = 1.73> <FuncUnit> <Opcode : 'add' 'sub'> <InPorts = 2> <OutPorts = 1>
ST_1 : Operation 20 [1/1] (1.30ns)   --->   "%icmp_ln63 = icmp_eq  i4 %i_load, i4 8" [dct.cpp:63]   --->   Operation 20 'icmp' 'icmp_ln63' <Predicate = (!icmp_ln61)> <Delay = 1.30> <CoreInst = "Cmp">   --->   Core 9 'Cmp' <Latency = 0> <II = 1> <Delay = 1.30> <FuncUnit> <Opcode : 'icmp'> <InPorts = 2> <OutPorts = 1>
ST_1 : Operation 21 [1/1] (1.02ns)   --->   "%select_ln61 = select i1 %icmp_ln63, i4 0, i4 %i_load" [dct.cpp:61]   --->   Operation 21 'select' 'select_ln61' <Predicate = (!icmp_ln61)> <Delay = 1.02> <CoreInst = "Sel">   --->   Core 73 'Sel' <Latency = 0> <II = 1> <Delay = 1.02> <FuncUnit> <Opcode : 'select'> <InPorts = 3> <OutPorts = 1>
ST_1 : Operation 22 [1/1] (0.00ns)   --->   "%trunc_ln61 = trunc i4 %select_ln61" [dct.cpp:61]   --->   Operation 22 'trunc' 'trunc_ln61' <Predicate = (!icmp_ln61)> <Delay = 0.00>
ST_1 : Operation 23 [1/1] (1.02ns)   --->   "%select_ln61_1 = select i1 %icmp_ln63, i4 %add_ln61, i4 %j_load" [dct.cpp:61]   --->   Operation 23 'select' 'select_ln61_1' <Predicate = (!icmp_ln61)> <Delay = 1.02> <CoreInst = "Sel">   --->   Core 73 'Sel' <Latency = 0> <II = 1> <Delay = 1.02> <FuncUnit> <Opcode : 'select'> <InPorts = 3> <OutPorts = 1>
ST_1 : Operation 24 [1/1] (0.00ns)   --->   "%trunc_ln61_1 = trunc i4 %select_ln61_1" [dct.cpp:61]   --->   Operation 24 'trunc' 'trunc_ln61_1' <Predicate = (!icmp_ln61)> <Delay = 0.00>
ST_1 : Operation 25 [1/1] (1.73ns)   --->   "%add_ln63 = add i4 %select_ln61, i4 1" [dct.cpp:63]   --->   Operation 25 'add' 'add_ln63' <Predicate = (!icmp_ln61)> <Delay = 1.73> <CoreInst = "Adder">   --->   Core 1 'Adder' <Latency = 0> <II = 1> <Delay = 1.73> <FuncUnit> <Opcode : 'add' 'sub'> <InPorts = 2> <OutPorts = 1>
ST_1 : Operation 26 [1/1] (1.58ns)   --->   "%store_ln63 = store i7 %add_ln61_1, i7 %indvar_flatten14" [dct.cpp:63]   --->   Operation 26 'store' 'store_ln63' <Predicate = (!icmp_ln61)> <Delay = 1.58>
ST_1 : Operation 27 [1/1] (1.58ns)   --->   "%store_ln63 = store i4 %select_ln61_1, i4 %j" [dct.cpp:63]   --->   Operation 27 'store' 'store_ln63' <Predicate = (!icmp_ln61)> <Delay = 1.58>
ST_1 : Operation 28 [1/1] (1.58ns)   --->   "%store_ln63 = store i4 %add_ln63, i4 %i" [dct.cpp:63]   --->   Operation 28 'store' 'store_ln63' <Predicate = (!icmp_ln61)> <Delay = 1.58>

State 2 <SV = 1> <Delay = 5.07>
ST_2 : Operation 29 [1/1] (0.00ns)   --->   "%zext_ln64 = zext i4 %select_ln61_1" [dct.cpp:64]   --->   Operation 29 'zext' 'zext_ln64' <Predicate = true> <Delay = 0.00>
ST_2 : Operation 30 [1/1] (0.00ns)   --->   "%tmp_1 = bitconcatenate i6 @_ssdm_op_BitConcatenate.i6.i3.i3, i3 %trunc_ln61_1, i3 0" [dct.cpp:64]   --->   Operation 30 'bitconcatenate' 'tmp_1' <Predicate = true> <Delay = 0.00>
ST_2 : Operation 31 [1/1] (0.00ns)   --->   "%zext_ln64_1 = zext i4 %select_ln61" [dct.cpp:64]   --->   Operation 31 'zext' 'zext_ln64_1' <Predicate = true> <Delay = 0.00>
ST_2 : Operation 32 [1/1] (1.82ns)   --->   "%add_ln64 = add i6 %tmp_1, i6 %zext_ln64_1" [dct.cpp:64]   --->   Operation 32 'add' 'add_ln64' <Predicate = true> <Delay = 1.82> <CoreInst = "Adder">   --->   Core 1 'Adder' <Latency = 0> <II = 1> <Delay = 1.82> <FuncUnit> <Opcode : 'add' 'sub'> <InPorts = 2> <OutPorts = 1>
ST_2 : Operation 33 [1/1] (0.00ns)   --->   "%tmp_2 = bitconcatenate i6 @_ssdm_op_BitConcatenate.i6.i3.i3, i3 %trunc_ln61, i3 0" [dct.cpp:64]   --->   Operation 33 'bitconcatenate' 'tmp_2' <Predicate = true> <Delay = 0.00>
ST_2 : Operation 34 [1/1] (1.82ns)   --->   "%add_ln64_1 = add i6 %tmp_2, i6 %zext_ln64" [dct.cpp:64]   --->   Operation 34 'add' 'add_ln64_1' <Predicate = true> <Delay = 1.82> <CoreInst = "Adder">   --->   Core 1 'Adder' <Latency = 0> <II = 1> <Delay = 1.82> <FuncUnit> <Opcode : 'add' 'sub'> <InPorts = 2> <OutPorts = 1>
ST_2 : Operation 35 [1/1] (0.00ns)   --->   "%zext_ln64_3 = zext i6 %add_ln64_1" [dct.cpp:64]   --->   Operation 35 'zext' 'zext_ln64_3' <Predicate = true> <Delay = 0.00>
ST_2 : Operation 36 [1/1] (0.00ns)   --->   "%col_outbuf_addr = getelementptr i16 %col_outbuf, i64 0, i64 %zext_ln64_3" [dct.cpp:64]   --->   Operation 36 'getelementptr' 'col_outbuf_addr' <Predicate = true> <Delay = 0.00>
ST_2 : Operation 37 [2/2] (3.25ns)   --->   "%col_outbuf_load = load i6 %col_outbuf_addr" [dct.cpp:64]   --->   Operation 37 'load' 'col_outbuf_load' <Predicate = true> <Delay = 3.25> <CoreInst = "RAM">   --->   Core 82 'RAM' <Latency = 1> <II = 1> <Delay = 3.25> <Storage> <Opcode : 'load' 'store'> <Ports = 2> <Width = 16> <Depth = 64> <RAM>
ST_2 : Operation 47 [1/1] (0.00ns)   --->   "%ret_ln0 = ret"   --->   Operation 47 'ret' 'ret_ln0' <Predicate = (icmp_ln61)> <Delay = 0.00>

State 3 <SV = 2> <Delay = 6.50>
ST_3 : Operation 38 [1/1] (0.00ns)   --->   "%specloopname_ln0 = specloopname void @_ssdm_op_SpecLoopName, void @Xpose_Col_Outer_Loop_Xpose_Col_Inner_Loop_str"   --->   Operation 38 'specloopname' 'specloopname_ln0' <Predicate = true> <Delay = 0.00>
ST_3 : Operation 39 [1/1] (0.00ns)   --->   "%empty = speclooptripcount i32 @_ssdm_op_SpecLoopTripCount, i64 64, i64 64, i64 64"   --->   Operation 39 'speclooptripcount' 'empty' <Predicate = true> <Delay = 0.00>
ST_3 : Operation 40 [1/1] (0.00ns)   --->   "%zext_ln64_2 = zext i6 %add_ln64" [dct.cpp:64]   --->   Operation 40 'zext' 'zext_ln64_2' <Predicate = true> <Delay = 0.00>
ST_3 : Operation 41 [1/1] (0.00ns)   --->   "%out_block_addr = getelementptr i16 %out_block, i64 0, i64 %zext_ln64_2" [dct.cpp:64]   --->   Operation 41 'getelementptr' 'out_block_addr' <Predicate = true> <Delay = 0.00>
ST_3 : Operation 42 [1/1] (0.00ns)   --->   "%specpipeline_ln8 = specpipeline void @_ssdm_op_SpecPipeline, i32 4294967295, i32 0, i32 0, i32 0, void @empty_0" [C:/Users/Richard/Desktop/Course/AAHLS/labs/labA/ug871-design-files-ch6/dct_prj/solution5/directives.tcl:8]   --->   Operation 42 'specpipeline' 'specpipeline_ln8' <Predicate = true> <Delay = 0.00>
ST_3 : Operation 43 [1/1] (0.00ns)   --->   "%specloopname_ln34 = specloopname void @_ssdm_op_SpecLoopName, void @empty_3" [dct.cpp:34]   --->   Operation 43 'specloopname' 'specloopname_ln34' <Predicate = true> <Delay = 0.00>
ST_3 : Operation 44 [1/2] (3.25ns)   --->   "%col_outbuf_load = load i6 %col_outbuf_addr" [dct.cpp:64]   --->   Operation 44 'load' 'col_outbuf_load' <Predicate = true> <Delay = 3.25> <CoreInst = "RAM">   --->   Core 82 'RAM' <Latency = 1> <II = 1> <Delay = 3.25> <Storage> <Opcode : 'load' 'store'> <Ports = 2> <Width = 16> <Depth = 64> <RAM>
ST_3 : Operation 45 [1/1] (3.25ns)   --->   "%store_ln64 = store i16 %col_outbuf_load, i6 %out_block_addr" [dct.cpp:64]   --->   Operation 45 'store' 'store_ln64' <Predicate = true> <Delay = 3.25> <CoreInst = "RAM">   --->   Core 82 'RAM' <Latency = 1> <II = 1> <Delay = 3.25> <Storage> <Opcode : 'load' 'store'> <Ports = 2> <Width = 16> <Depth = 64> <RAM>
ST_3 : Operation 46 [1/1] (0.00ns)   --->   "%br_ln63 = br void %for.inc50" [dct.cpp:63]   --->   Operation 46 'br' 'br_ln63' <Predicate = true> <Delay = 0.00>


============================================================
+ Verbose Summary: Timing violations
============================================================
Target clock period: 10ns, clock uncertainty: 2.7ns.

 <State 1>: 5.65ns
The critical path consists of the following:
	'alloca' operation ('i') [3]  (0 ns)
	'load' operation ('i_load', dct.cpp:63) on local variable 'i' [16]  (0 ns)
	'icmp' operation ('icmp_ln63', dct.cpp:63) [21]  (1.3 ns)
	'select' operation ('select_ln61', dct.cpp:61) [22]  (1.02 ns)
	'add' operation ('add_ln63', dct.cpp:63) [40]  (1.74 ns)
	'store' operation ('store_ln63', dct.cpp:63) of variable 'add_ln63', dct.cpp:63 on local variable 'i' [43]  (1.59 ns)

 <State 2>: 5.08ns
The critical path consists of the following:
	'add' operation ('add_ln64_1', dct.cpp:64) [33]  (1.83 ns)
	'getelementptr' operation ('col_outbuf_addr', dct.cpp:64) [35]  (0 ns)
	'load' operation ('col_outbuf_load', dct.cpp:64) on array 'col_outbuf' [38]  (3.25 ns)

 <State 3>: 6.51ns
The critical path consists of the following:
	'load' operation ('col_outbuf_load', dct.cpp:64) on array 'col_outbuf' [38]  (3.25 ns)
	'store' operation ('store_ln64', dct.cpp:64) of variable 'col_outbuf_load', dct.cpp:64 on array 'out_block' [39]  (3.25 ns)


============================================================
+ Verbose Summary: Binding
============================================================
N/A
* FSMD analyzer results:
  - Output states:
 - Input state : 
  - Chain level:
	State 1
	State 2
	State 3


============================================================
+ Verbose Summary: Datapath Resource usage 
============================================================
N/A
