

================================================================
== Vitis HLS Report for 'dct_2d_Pipeline_Xpose_Row_Outer_Loop_Xpose_Row_Inner_Loop'
================================================================
* Date:           Mon Mar  6 13:53:03 2023

* Version:        2022.1 (Build 3526262 on Mon Apr 18 15:48:16 MDT 2022)
* Project:        dct_prj
* Solution:       solution5 (Vivado IP Flow Target)
* Product family: zynq
* Target device:  xc7z020-clg400-1


================================================================
== Performance Estimates
================================================================
+ Timing: 
    * Summary: 
    +--------+----------+----------+------------+
    |  Clock |  Target  | Estimated| Uncertainty|
    +--------+----------+----------+------------+
    |ap_clk  |  10.00 ns|  5.649 ns|     2.70 ns|
    +--------+----------+----------+------------+

+ Latency: 
    * Summary: 
    +---------+---------+----------+----------+-----+-----+---------+
    |  Latency (cycles) |  Latency (absolute) |  Interval | Pipeline|
    |   min   |   max   |    min   |    max   | min | max |   Type  |
    +---------+---------+----------+----------+-----+-----+---------+
    |       67|       67|  0.670 us|  0.670 us|   67|   67|       no|
    +---------+---------+----------+----------+-----+-----+---------+

    + Detail: 
        * Instance: 
        N/A

        * Loop: 
        +---------------------------------------------+---------+---------+----------+-----------+-----------+------+----------+
        |                                             |  Latency (cycles) | Iteration|  Initiation Interval  | Trip |          |
        |                  Loop Name                  |   min   |   max   |  Latency |  achieved |   target  | Count| Pipelined|
        +---------------------------------------------+---------+---------+----------+-----------+-----------+------+----------+
        |- Xpose_Row_Outer_Loop_Xpose_Row_Inner_Loop  |       65|       65|         3|          1|          1|    64|       yes|
        +---------------------------------------------+---------+---------+----------+-----------+-----------+------+----------+

============================================================
+ Verbose Summary: Synthesis Manager
============================================================
InlineROM: 1
ExposeGlobal: 0
============================================================
+ Verbose Summary: CDFG Model
============================================================
IsTopModel: 0
ResetActiveHigh: 1
IsCombinational: 0
IsDatapathOnly: 0
HasWiredReturn: 1
HasMFsm: 2
HasVarLatency: 1
IsPipeline: 0
IsRtlPipelined: 0
IsInstanceOverlapped: 0
IsDontTouch: 0
HasImplIP: 0
IsGatedGlobalClock: 0

+ Individual pipeline summary: 
  * Pipeline-0: initiation interval (II) = 1, depth = 3


============================================================
+ Verbose Summary: Schedule
============================================================
* Number of FSM states : 3
* Pipeline : 1
  Pipeline-0 : II = 1, D = 3, States = { 1 2 3 }
* Dataflow Pipeline: 0

* FSM state transitions: 
1 --> 2 
2 --> 3 
3 --> 

* FSM state operations: 

State 1 <SV = 0> <Delay = 5.64>
ST_1 : Operation 6 [1/1] (0.00ns)   --->   "%i = alloca i32 1"   --->   Operation 6 'alloca' 'i' <Predicate = true> <Delay = 0.00>
ST_1 : Operation 7 [1/1] (0.00ns)   --->   "%j = alloca i32 1"   --->   Operation 7 'alloca' 'j' <Predicate = true> <Delay = 0.00>
ST_1 : Operation 8 [1/1] (0.00ns)   --->   "%indvar_flatten = alloca i32 1"   --->   Operation 8 'alloca' 'indvar_flatten' <Predicate = true> <Delay = 0.00>
ST_1 : Operation 9 [1/1] (1.58ns)   --->   "%store_ln0 = store i7 0, i7 %indvar_flatten"   --->   Operation 9 'store' 'store_ln0' <Predicate = true> <Delay = 1.58>
ST_1 : Operation 10 [1/1] (1.58ns)   --->   "%store_ln0 = store i4 0, i4 %j"   --->   Operation 10 'store' 'store_ln0' <Predicate = true> <Delay = 1.58>
ST_1 : Operation 11 [1/1] (1.58ns)   --->   "%store_ln0 = store i4 0, i4 %i"   --->   Operation 11 'store' 'store_ln0' <Predicate = true> <Delay = 1.58>
ST_1 : Operation 12 [1/1] (0.00ns)   --->   "%br_ln0 = br void %for.inc18"   --->   Operation 12 'br' 'br_ln0' <Predicate = true> <Delay = 0.00>
ST_1 : Operation 13 [1/1] (0.00ns)   --->   "%indvar_flatten_load = load i7 %indvar_flatten" [dct.cpp:46]   --->   Operation 13 'load' 'indvar_flatten_load' <Predicate = true> <Delay = 0.00>
ST_1 : Operation 14 [1/1] (1.48ns)   --->   "%icmp_ln46 = icmp_eq  i7 %indvar_flatten_load, i7 64" [dct.cpp:46]   --->   Operation 14 'icmp' 'icmp_ln46' <Predicate = true> <Delay = 1.48> <CoreInst = "Cmp">   --->   Core 9 'Cmp' <Latency = 0> <II = 1> <Delay = 1.48> <FuncUnit> <Opcode : 'icmp'> <InPorts = 2> <OutPorts = 1>
ST_1 : Operation 15 [1/1] (1.87ns)   --->   "%add_ln46_1 = add i7 %indvar_flatten_load, i7 1" [dct.cpp:46]   --->   Operation 15 'add' 'add_ln46_1' <Predicate = true> <Delay = 1.87> <CoreInst = "Adder">   --->   Core 1 'Adder' <Latency = 0> <II = 1> <Delay = 1.87> <FuncUnit> <Opcode : 'add' 'sub'> <InPorts = 2> <OutPorts = 1>
ST_1 : Operation 16 [1/1] (0.00ns)   --->   "%br_ln46 = br i1 %icmp_ln46, void %for.inc21, void %for.inc33.preheader.exitStub" [dct.cpp:46]   --->   Operation 16 'br' 'br_ln46' <Predicate = true> <Delay = 0.00>
ST_1 : Operation 17 [1/1] (0.00ns)   --->   "%i_load = load i4 %i" [dct.cpp:48]   --->   Operation 17 'load' 'i_load' <Predicate = (!icmp_ln46)> <Delay = 0.00>
ST_1 : Operation 18 [1/1] (0.00ns)   --->   "%j_load = load i4 %j" [dct.cpp:46]   --->   Operation 18 'load' 'j_load' <Predicate = (!icmp_ln46)> <Delay = 0.00>
ST_1 : Operation 19 [1/1] (1.73ns)   --->   "%add_ln46 = add i4 %j_load, i4 1" [dct.cpp:46]   --->   Operation 19 'add' 'add_ln46' <Predicate = (!icmp_ln46)> <Delay = 1.73> <CoreInst = "Adder">   --->   Core 1 'Adder' <Latency = 0> <II = 1> <Delay = 1.73> <FuncUnit> <Opcode : 'add' 'sub'> <InPorts = 2> <OutPorts = 1>
ST_1 : Operation 20 [1/1] (1.30ns)   --->   "%icmp_ln48 = icmp_eq  i4 %i_load, i4 8" [dct.cpp:48]   --->   Operation 20 'icmp' 'icmp_ln48' <Predicate = (!icmp_ln46)> <Delay = 1.30> <CoreInst = "Cmp">   --->   Core 9 'Cmp' <Latency = 0> <II = 1> <Delay = 1.30> <FuncUnit> <Opcode : 'icmp'> <InPorts = 2> <OutPorts = 1>
ST_1 : Operation 21 [1/1] (1.02ns)   --->   "%select_ln46 = select i1 %icmp_ln48, i4 0, i4 %i_load" [dct.cpp:46]   --->   Operation 21 'select' 'select_ln46' <Predicate = (!icmp_ln46)> <Delay = 1.02> <CoreInst = "Sel">   --->   Core 73 'Sel' <Latency = 0> <II = 1> <Delay = 1.02> <FuncUnit> <Opcode : 'select'> <InPorts = 3> <OutPorts = 1>
ST_1 : Operation 22 [1/1] (0.00ns)   --->   "%trunc_ln46 = trunc i4 %select_ln46" [dct.cpp:46]   --->   Operation 22 'trunc' 'trunc_ln46' <Predicate = (!icmp_ln46)> <Delay = 0.00>
ST_1 : Operation 23 [1/1] (1.02ns)   --->   "%select_ln46_1 = select i1 %icmp_ln48, i4 %add_ln46, i4 %j_load" [dct.cpp:46]   --->   Operation 23 'select' 'select_ln46_1' <Predicate = (!icmp_ln46)> <Delay = 1.02> <CoreInst = "Sel">   --->   Core 73 'Sel' <Latency = 0> <II = 1> <Delay = 1.02> <FuncUnit> <Opcode : 'select'> <InPorts = 3> <OutPorts = 1>
ST_1 : Operation 24 [1/1] (0.00ns)   --->   "%zext_ln49 = zext i4 %select_ln46_1" [dct.cpp:49]   --->   Operation 24 'zext' 'zext_ln49' <Predicate = (!icmp_ln46)> <Delay = 0.00>
ST_1 : Operation 25 [1/1] (0.00ns)   --->   "%tmp = bitconcatenate i6 @_ssdm_op_BitConcatenate.i6.i3.i3, i3 %trunc_ln46, i3 0" [dct.cpp:49]   --->   Operation 25 'bitconcatenate' 'tmp' <Predicate = (!icmp_ln46)> <Delay = 0.00>
ST_1 : Operation 26 [1/1] (1.82ns)   --->   "%add_ln49 = add i6 %tmp, i6 %zext_ln49" [dct.cpp:49]   --->   Operation 26 'add' 'add_ln49' <Predicate = (!icmp_ln46)> <Delay = 1.82> <CoreInst = "Adder">   --->   Core 1 'Adder' <Latency = 0> <II = 1> <Delay = 1.82> <FuncUnit> <Opcode : 'add' 'sub'> <InPorts = 2> <OutPorts = 1>
ST_1 : Operation 27 [1/1] (0.95ns)   --->   "%switch_ln49 = switch i3 %trunc_ln46, void %arrayidx176.case.7, i3 0, void %arrayidx176.case.0, i3 1, void %arrayidx176.case.1, i3 2, void %arrayidx176.case.2, i3 3, void %arrayidx176.case.3, i3 4, void %arrayidx176.case.4, i3 5, void %arrayidx176.case.5, i3 6, void %arrayidx176.case.6" [dct.cpp:49]   --->   Operation 27 'switch' 'switch_ln49' <Predicate = (!icmp_ln46)> <Delay = 0.95>
ST_1 : Operation 28 [1/1] (1.73ns)   --->   "%add_ln48 = add i4 %select_ln46, i4 1" [dct.cpp:48]   --->   Operation 28 'add' 'add_ln48' <Predicate = (!icmp_ln46)> <Delay = 1.73> <CoreInst = "Adder">   --->   Core 1 'Adder' <Latency = 0> <II = 1> <Delay = 1.73> <FuncUnit> <Opcode : 'add' 'sub'> <InPorts = 2> <OutPorts = 1>
ST_1 : Operation 29 [1/1] (1.58ns)   --->   "%store_ln48 = store i7 %add_ln46_1, i7 %indvar_flatten" [dct.cpp:48]   --->   Operation 29 'store' 'store_ln48' <Predicate = (!icmp_ln46)> <Delay = 1.58>
ST_1 : Operation 30 [1/1] (1.58ns)   --->   "%store_ln48 = store i4 %select_ln46_1, i4 %j" [dct.cpp:48]   --->   Operation 30 'store' 'store_ln48' <Predicate = (!icmp_ln46)> <Delay = 1.58>
ST_1 : Operation 31 [1/1] (1.58ns)   --->   "%store_ln48 = store i4 %add_ln48, i4 %i" [dct.cpp:48]   --->   Operation 31 'store' 'store_ln48' <Predicate = (!icmp_ln46)> <Delay = 1.58>
ST_1 : Operation 32 [1/1] (0.00ns)   --->   "%br_ln48 = br void %for.inc18" [dct.cpp:48]   --->   Operation 32 'br' 'br_ln48' <Predicate = (!icmp_ln46)> <Delay = 0.00>

State 2 <SV = 1> <Delay = 3.25>
ST_2 : Operation 33 [1/1] (0.00ns)   --->   "%zext_ln49_1 = zext i6 %add_ln49" [dct.cpp:49]   --->   Operation 33 'zext' 'zext_ln49_1' <Predicate = true> <Delay = 0.00>
ST_2 : Operation 34 [1/1] (0.00ns)   --->   "%row_outbuf_addr = getelementptr i16 %row_outbuf, i64 0, i64 %zext_ln49_1" [dct.cpp:49]   --->   Operation 34 'getelementptr' 'row_outbuf_addr' <Predicate = true> <Delay = 0.00>
ST_2 : Operation 35 [2/2] (3.25ns)   --->   "%row_outbuf_load = load i6 %row_outbuf_addr" [dct.cpp:49]   --->   Operation 35 'load' 'row_outbuf_load' <Predicate = true> <Delay = 3.25> <CoreInst = "RAM">   --->   Core 82 'RAM' <Latency = 1> <II = 1> <Delay = 3.25> <Storage> <Opcode : 'load' 'store'> <Ports = 2> <Width = 16> <Depth = 64> <RAM>
ST_2 : Operation 66 [1/1] (0.00ns)   --->   "%ret_ln0 = ret"   --->   Operation 66 'ret' 'ret_ln0' <Predicate = (icmp_ln46)> <Delay = 0.00>

State 3 <SV = 2> <Delay = 5.57>
ST_3 : Operation 36 [1/1] (0.00ns)   --->   "%specloopname_ln0 = specloopname void @_ssdm_op_SpecLoopName, void @Xpose_Row_Outer_Loop_Xpose_Row_Inner_Loop_str"   --->   Operation 36 'specloopname' 'specloopname_ln0' <Predicate = true> <Delay = 0.00>
ST_3 : Operation 37 [1/1] (0.00ns)   --->   "%empty = speclooptripcount i32 @_ssdm_op_SpecLoopTripCount, i64 64, i64 64, i64 64"   --->   Operation 37 'speclooptripcount' 'empty' <Predicate = true> <Delay = 0.00>
ST_3 : Operation 38 [1/1] (0.00ns)   --->   "%zext_ln46 = zext i4 %select_ln46_1" [dct.cpp:46]   --->   Operation 38 'zext' 'zext_ln46' <Predicate = true> <Delay = 0.00>
ST_3 : Operation 39 [1/1] (0.00ns)   --->   "%specpipeline_ln7 = specpipeline void @_ssdm_op_SpecPipeline, i32 4294967295, i32 0, i32 0, i32 0, void @empty_0" [C:/Users/Richard/Desktop/Course/AAHLS/labs/labA/ug871-design-files-ch6/dct_prj/solution5/directives.tcl:7]   --->   Operation 39 'specpipeline' 'specpipeline_ln7' <Predicate = true> <Delay = 0.00>
ST_3 : Operation 40 [1/1] (0.00ns)   --->   "%specloopname_ln34 = specloopname void @_ssdm_op_SpecLoopName, void @empty_5" [dct.cpp:34]   --->   Operation 40 'specloopname' 'specloopname_ln34' <Predicate = true> <Delay = 0.00>
ST_3 : Operation 41 [1/2] (3.25ns)   --->   "%row_outbuf_load = load i6 %row_outbuf_addr" [dct.cpp:49]   --->   Operation 41 'load' 'row_outbuf_load' <Predicate = true> <Delay = 3.25> <CoreInst = "RAM">   --->   Core 82 'RAM' <Latency = 1> <II = 1> <Delay = 3.25> <Storage> <Opcode : 'load' 'store'> <Ports = 2> <Width = 16> <Depth = 64> <RAM>
ST_3 : Operation 42 [1/1] (0.00ns)   --->   "%col_inbuf_6_addr = getelementptr i16 %col_inbuf_6, i64 0, i64 %zext_ln46" [dct.cpp:46]   --->   Operation 42 'getelementptr' 'col_inbuf_6_addr' <Predicate = (trunc_ln46 == 6)> <Delay = 0.00>
ST_3 : Operation 43 [1/1] (2.32ns)   --->   "%store_ln49 = store i16 %row_outbuf_load, i3 %col_inbuf_6_addr" [dct.cpp:49]   --->   Operation 43 'store' 'store_ln49' <Predicate = (trunc_ln46 == 6)> <Delay = 2.32> <CoreInst = "RAM">   --->   Core 82 'RAM' <Latency = 1> <II = 1> <Delay = 2.32> <Storage> <Opcode : 'load' 'store'> <Ports = 2> <Width = 16> <Depth = 8> <RAM>
ST_3 : Operation 44 [1/1] (0.00ns)   --->   "%br_ln49 = br void %arrayidx176.exit" [dct.cpp:49]   --->   Operation 44 'br' 'br_ln49' <Predicate = (trunc_ln46 == 6)> <Delay = 0.00>
ST_3 : Operation 45 [1/1] (0.00ns)   --->   "%col_inbuf_5_addr = getelementptr i16 %col_inbuf_5, i64 0, i64 %zext_ln46" [dct.cpp:46]   --->   Operation 45 'getelementptr' 'col_inbuf_5_addr' <Predicate = (trunc_ln46 == 5)> <Delay = 0.00>
ST_3 : Operation 46 [1/1] (2.32ns)   --->   "%store_ln49 = store i16 %row_outbuf_load, i3 %col_inbuf_5_addr" [dct.cpp:49]   --->   Operation 46 'store' 'store_ln49' <Predicate = (trunc_ln46 == 5)> <Delay = 2.32> <CoreInst = "RAM">   --->   Core 82 'RAM' <Latency = 1> <II = 1> <Delay = 2.32> <Storage> <Opcode : 'load' 'store'> <Ports = 2> <Width = 16> <Depth = 8> <RAM>
ST_3 : Operation 47 [1/1] (0.00ns)   --->   "%br_ln49 = br void %arrayidx176.exit" [dct.cpp:49]   --->   Operation 47 'br' 'br_ln49' <Predicate = (trunc_ln46 == 5)> <Delay = 0.00>
ST_3 : Operation 48 [1/1] (0.00ns)   --->   "%col_inbuf_4_addr = getelementptr i16 %col_inbuf_4, i64 0, i64 %zext_ln46" [dct.cpp:46]   --->   Operation 48 'getelementptr' 'col_inbuf_4_addr' <Predicate = (trunc_ln46 == 4)> <Delay = 0.00>
ST_3 : Operation 49 [1/1] (2.32ns)   --->   "%store_ln49 = store i16 %row_outbuf_load, i3 %col_inbuf_4_addr" [dct.cpp:49]   --->   Operation 49 'store' 'store_ln49' <Predicate = (trunc_ln46 == 4)> <Delay = 2.32> <CoreInst = "RAM">   --->   Core 82 'RAM' <Latency = 1> <II = 1> <Delay = 2.32> <Storage> <Opcode : 'load' 'store'> <Ports = 2> <Width = 16> <Depth = 8> <RAM>
ST_3 : Operation 50 [1/1] (0.00ns)   --->   "%br_ln49 = br void %arrayidx176.exit" [dct.cpp:49]   --->   Operation 50 'br' 'br_ln49' <Predicate = (trunc_ln46 == 4)> <Delay = 0.00>
ST_3 : Operation 51 [1/1] (0.00ns)   --->   "%col_inbuf_3_addr = getelementptr i16 %col_inbuf_3, i64 0, i64 %zext_ln46" [dct.cpp:46]   --->   Operation 51 'getelementptr' 'col_inbuf_3_addr' <Predicate = (trunc_ln46 == 3)> <Delay = 0.00>
ST_3 : Operation 52 [1/1] (2.32ns)   --->   "%store_ln49 = store i16 %row_outbuf_load, i3 %col_inbuf_3_addr" [dct.cpp:49]   --->   Operation 52 'store' 'store_ln49' <Predicate = (trunc_ln46 == 3)> <Delay = 2.32> <CoreInst = "RAM">   --->   Core 82 'RAM' <Latency = 1> <II = 1> <Delay = 2.32> <Storage> <Opcode : 'load' 'store'> <Ports = 2> <Width = 16> <Depth = 8> <RAM>
ST_3 : Operation 53 [1/1] (0.00ns)   --->   "%br_ln49 = br void %arrayidx176.exit" [dct.cpp:49]   --->   Operation 53 'br' 'br_ln49' <Predicate = (trunc_ln46 == 3)> <Delay = 0.00>
ST_3 : Operation 54 [1/1] (0.00ns)   --->   "%col_inbuf_2_addr = getelementptr i16 %col_inbuf_2, i64 0, i64 %zext_ln46" [dct.cpp:46]   --->   Operation 54 'getelementptr' 'col_inbuf_2_addr' <Predicate = (trunc_ln46 == 2)> <Delay = 0.00>
ST_3 : Operation 55 [1/1] (2.32ns)   --->   "%store_ln49 = store i16 %row_outbuf_load, i3 %col_inbuf_2_addr" [dct.cpp:49]   --->   Operation 55 'store' 'store_ln49' <Predicate = (trunc_ln46 == 2)> <Delay = 2.32> <CoreInst = "RAM">   --->   Core 82 'RAM' <Latency = 1> <II = 1> <Delay = 2.32> <Storage> <Opcode : 'load' 'store'> <Ports = 2> <Width = 16> <Depth = 8> <RAM>
ST_3 : Operation 56 [1/1] (0.00ns)   --->   "%br_ln49 = br void %arrayidx176.exit" [dct.cpp:49]   --->   Operation 56 'br' 'br_ln49' <Predicate = (trunc_ln46 == 2)> <Delay = 0.00>
ST_3 : Operation 57 [1/1] (0.00ns)   --->   "%col_inbuf_1_addr = getelementptr i16 %col_inbuf_1, i64 0, i64 %zext_ln46" [dct.cpp:46]   --->   Operation 57 'getelementptr' 'col_inbuf_1_addr' <Predicate = (trunc_ln46 == 1)> <Delay = 0.00>
ST_3 : Operation 58 [1/1] (2.32ns)   --->   "%store_ln49 = store i16 %row_outbuf_load, i3 %col_inbuf_1_addr" [dct.cpp:49]   --->   Operation 58 'store' 'store_ln49' <Predicate = (trunc_ln46 == 1)> <Delay = 2.32> <CoreInst = "RAM">   --->   Core 82 'RAM' <Latency = 1> <II = 1> <Delay = 2.32> <Storage> <Opcode : 'load' 'store'> <Ports = 2> <Width = 16> <Depth = 8> <RAM>
ST_3 : Operation 59 [1/1] (0.00ns)   --->   "%br_ln49 = br void %arrayidx176.exit" [dct.cpp:49]   --->   Operation 59 'br' 'br_ln49' <Predicate = (trunc_ln46 == 1)> <Delay = 0.00>
ST_3 : Operation 60 [1/1] (0.00ns)   --->   "%col_inbuf_addr = getelementptr i16 %col_inbuf, i64 0, i64 %zext_ln46" [dct.cpp:46]   --->   Operation 60 'getelementptr' 'col_inbuf_addr' <Predicate = (trunc_ln46 == 0)> <Delay = 0.00>
ST_3 : Operation 61 [1/1] (2.32ns)   --->   "%store_ln49 = store i16 %row_outbuf_load, i3 %col_inbuf_addr" [dct.cpp:49]   --->   Operation 61 'store' 'store_ln49' <Predicate = (trunc_ln46 == 0)> <Delay = 2.32> <CoreInst = "RAM">   --->   Core 82 'RAM' <Latency = 1> <II = 1> <Delay = 2.32> <Storage> <Opcode : 'load' 'store'> <Ports = 2> <Width = 16> <Depth = 8> <RAM>
ST_3 : Operation 62 [1/1] (0.00ns)   --->   "%br_ln49 = br void %arrayidx176.exit" [dct.cpp:49]   --->   Operation 62 'br' 'br_ln49' <Predicate = (trunc_ln46 == 0)> <Delay = 0.00>
ST_3 : Operation 63 [1/1] (0.00ns)   --->   "%col_inbuf_7_addr = getelementptr i16 %col_inbuf_7, i64 0, i64 %zext_ln46" [dct.cpp:46]   --->   Operation 63 'getelementptr' 'col_inbuf_7_addr' <Predicate = (trunc_ln46 == 7)> <Delay = 0.00>
ST_3 : Operation 64 [1/1] (2.32ns)   --->   "%store_ln49 = store i16 %row_outbuf_load, i3 %col_inbuf_7_addr" [dct.cpp:49]   --->   Operation 64 'store' 'store_ln49' <Predicate = (trunc_ln46 == 7)> <Delay = 2.32> <CoreInst = "RAM">   --->   Core 82 'RAM' <Latency = 1> <II = 1> <Delay = 2.32> <Storage> <Opcode : 'load' 'store'> <Ports = 2> <Width = 16> <Depth = 8> <RAM>
ST_3 : Operation 65 [1/1] (0.00ns)   --->   "%br_ln49 = br void %arrayidx176.exit" [dct.cpp:49]   --->   Operation 65 'br' 'br_ln49' <Predicate = (trunc_ln46 == 7)> <Delay = 0.00>


============================================================
+ Verbose Summary: Timing violations
============================================================
Target clock period: 10ns, clock uncertainty: 2.7ns.

 <State 1>: 5.65ns
The critical path consists of the following:
	'alloca' operation ('i') [10]  (0 ns)
	'load' operation ('i_load', dct.cpp:48) on local variable 'i' [23]  (0 ns)
	'icmp' operation ('icmp_ln48', dct.cpp:48) [28]  (1.3 ns)
	'select' operation ('select_ln46', dct.cpp:46) [29]  (1.02 ns)
	'add' operation ('add_ln48', dct.cpp:48) [75]  (1.74 ns)
	'store' operation ('store_ln48', dct.cpp:48) of variable 'add_ln48', dct.cpp:48 on local variable 'i' [78]  (1.59 ns)

 <State 2>: 3.25ns
The critical path consists of the following:
	'getelementptr' operation ('row_outbuf_addr', dct.cpp:49) [37]  (0 ns)
	'load' operation ('row_outbuf_load', dct.cpp:49) on array 'row_outbuf' [40]  (3.25 ns)

 <State 3>: 5.58ns
The critical path consists of the following:
	'load' operation ('row_outbuf_load', dct.cpp:49) on array 'row_outbuf' [40]  (3.25 ns)
	'store' operation ('store_ln49', dct.cpp:49) of variable 'row_outbuf_load', dct.cpp:49 on array 'col_inbuf_3' [56]  (2.32 ns)


============================================================
+ Verbose Summary: Binding
============================================================
N/A
* FSMD analyzer results:
  - Output states:
 - Input state : 
  - Chain level:
	State 1
	State 2
	State 3


============================================================
+ Verbose Summary: Datapath Resource usage 
============================================================
N/A
